{"id": "tc-abcdefgh", "name": "true", "display_name": "true", "marker": null, "marker_text": null, "labels": [], "placement": "default", "session": "termctl", "pane_id": "%5", "window_id": "@3", "socket_path": "/tmp/tmux-1000/default", "created": "2026-01-01T00:00:00.000Z", "pid": null, "state": "gone", "exit_status": null, "exit_signal": null, "keep_on_exit": "never", "focused": false, "decision_ids": []}
